<?xml version="1.0" encoding="UTF-8" standalone="no"?>
<pedidos xmlns:xsi="http://www.w3.org/2001/XMLSchema-instance" xsi:noNamespaceSchemaLocation="pedidos.xsd">
	<pedido cod_pedido="A1234567"><!--Formado por una cadena de 8 caracteres de los cuales el primero es una letra-->
		<!--CENTRO ADMINISTRATIVO Y INFORMACION ENVIO-->
		<sucursal></sucursal><!--Datos de la sucursal que realiza el pedido-->
		<dir_entrega></dir_entrega><!--Direcciones para los envíos correspondientes-->
		<!--PEDIDO-->
		<nom_trabajador></nom_trabajador><!--Nombre del trabajador que realiza el pedido.-->
		<f_pedido>2001-10-26</f_pedido><!--Fecha del pedido.-->
		<obs_pedido>Incompleto</obs_pedido><!--Observaciones sobre el pedido, cuyos valores son, en caso de que exista el dato: urgente o incompleto.-->
		<plazo_revision>4</plazo_revision><!--Plazo de revisión de los productos recibidos que será un intervalo de tiempo expresado en días y dependerá del precio final del pedido.-->
		<!--ARTICULO-->
		<articulo cod_articulo="Articulo Test"><!--Código del artículo, formado por tres letras mayúsculas y tres dígitos separados por un guión. Es la referencia que tiene que dar el ordenante a la sede en caso de devolución de algún artículo.-->
			<unidades>1</unidades><!--Número de unidades pedidas.-->
			<precio_und>10</precio_und><!--Precio de cada unidad.-->
			<obs_articulo></obs_articulo><!--Observaciones del artículo.-->
		</articulo>
	</pedido>
</pedidos>
		